uid,body,title,url,newspaper_uid,host,n_tokens_title,n_tokens_body
e78a0aefc36c825175225c2f96908050,"Venecia. Como un testimonio íntimo, para no olvidar, el célebre músico brasileño Caetano Veloso narra en un documental, presentado este domingo a la prensa en la Mostra de Venecia, los 54 días pasados en la cárcel durante la dictadura militar en Brasil (1964-1985).Con el título ""Narciso Fuera de Servicio"", el músico bahiano, de 78 años, cuenta su arresto en 1968 por orden de los militares, entona algunas canciones y de alguna manera alerta a las nuevas generaciones sobre los peligros de las doctrinas fascistas.Escrito y dirigido por Renato Terra ( Una noche en el 67) y Ricardo Calil ( Cine Marruecos), el documental, de 83 minutos de duración, es también una suerte de denuncia de las persecuciones y los prejuicios políticos contra el mundo del arte.Veloso, figura clave para la cultura popular brasileña y un referente mundial de la música sudamericana, no pudo asistir al estreno en Venecia debido a las limitaciones impuestas por las autoridades italianas a causa de la pandemia de coronavirus.Después de tres décadas de avances en materia de derechos individuales tras la salida de la dictadura militar (1964-1985) y trece años de gobiernos izquierdistas (2003-2016), la voz de la resistencia en Brasil, como suele ser considerado Veloso en su país, rememora esa dolorosa experiencia, que marcó su vida y la de su país.Sílabas y endecasílabos Los largos días pasados en una celda solo, sus sentimientos, miedos y pensamientos, inclusive sexuales, son de alguna manera una invitación a reflexionar sobre lo que implica el empuje conservador de estos días, que encontró su expresión en el discurso del gobierno del derechista y ex militar Jair Bolsonaro.El músico, poeta y activista, deja su testimonio, para que de alguna manera las nuevas generaciones no olviden lo que fue la dictadura militar.Con su testimonio, tierno y conmovedor, Veloso denuncia esos años negros.""Desde mi celda escuchaba gritos, eran de las personas que estaban siendo torturadas. ¡Yo estaba aterrado!"", confiesa sentado ante la cámara fija frente a un muro color gris metálico.En el documental, el artista rememora el período del encierro y revive episodios dolorosos e inolvidables vividos con otros prisioneros, entre ellos con el cantautor Gilberto Gil, su amigo, los dos representantes del movimiento musical Tropicalia y encarcelados por ofender a la bandera y el himno nacional.Ambos tuvieron que exiliarse al ser excarcelados y continuaron en Europa su labor creativa.Con tono casi divertido relee el interrogatorio hecho por la policía y recientemente hallado en los archivos de la institución, en el que lo acusan de ""terrorismo cultural"" por haber cambiado las palabras del himno nacional.""No se puede: el himno tiene versos endecasílabos y en Tropicalia las sílabas son más largas y poéticas"", respondió, según reza el documento.""Traté de defenderme sin ser traidor"", comenta ante la cámara.Presentado en Venecia fuera de concurso, el filme que no lleva otras imágenes ni otras entrevistas, es un largo relato sobre esos días, sobre las arbitrariedades cometidas por los militares y de cómo nació una forma de resistencia contra la dictadura a partir de un nuevo género musical, Tropicalia, una mezcla libre de géneros y ritmos. ",Documental de Veloso narra su paso por cárcel en la dictadura de Brasil,https://www.jornada.com.mx/ultimas/espectaculos/2020/09/06/documental-de-veloso-narra-su-estancia-en-la-carcel-durante-la-dictadura-3910.html,lajornada,www.jornada.com.mx,7,257
7d7387bc2276364c613e696deff25db9,"Ciudad de México. El subsecretario de Prevención y Promoción de la Salud, Hugo López-Gatell, informó que este día se sumaron las confirmaciones de 4 mil 614 casos de Covid-19, con lo que el registro nacional llegó a 634 mil 23. También se tuvo el resultado de las pruebas de laboratorio de 232 fallecimientos, para un total hasta el día de hoy de 67 mil 558 personas que han perdido la vida por esta causa.Indicó que hay 82 mil 215 casos sospechosos. Se han realizado un millón 431 mil 633 pruebas, de las cuales 715 mil 395 tuvieron un resultado negativo para el virus SARS-CoV-2. De las personas que han enfermado con el coronavirus, 442 mil 268 se han recuperado.El funcionario reiteró que las medidas de prevención, realizadas por todas las personas tienen un efecto importante en la reducción del contagio del coronavirus. Estas son mantener la sana distancia entre personas, al menos un metro y medio; el lavado constante de manos y el uso de cubrebocas como auxiliar en los espacios cerrados donde se dificulta mantener el distanciamiento entre individuos.También exhortó a la población a que ante la presencia de síntomas como, tos, fiebre, falta de aire, dolor de cabeza, pérdida del olfato y diarrea, entre otros, acudan a los servicios médicos, sobre todo si viven con alguna de las condiciones identificadas como de riesgo para desarrollar complicaciones graves por Covid-19: personas mayores de 60 años, si viven con obesidad, diabetes e hipertensión u otras enfermedades crónicas.",Registro nacional de contagios de Covid-19 llega a 634 mil 23 afectados,https://www.jornada.com.mx/ultimas/politica/2020/09/06/registro-nacional-de-contagio-de-covid-llega-a-634-mil-23-afectados-8832.html,lajornada,www.jornada.com.mx,6,110
a04f717bc0cd00fd638da1b1011cffe4,"Ciudad de México. Un juez de control vinculó a proceso a Francisco San Juan “N”, por la probable comisión del delito de violación equiparada, informó la Fiscalía General de Justicia. Durante la audiencia inicial, el representante social, adscrito a la Coordinación General de Delitos de Género y Atención a Víctimas formuló la imputación respectiva. Una vez que el juez calificó como legal la detención, le impuso prisión preventiva oficiosa, como medida cautelar y fijó dos meses para el cierre de la investigación complementaria. El imputado fue detenido en la alcaldía Miguel Hidalgo luego de que la víctima solicitara auxilio a policías preventivos de la Secretaría de Seguridad Ciudadana. Los elementos lo pusieron a disposición del Ministerio Público y, de acuerdo con la indagatoria, presuntamente agredió sexualmente con violencia moral a la denunciante, en el parque Tamayo, ubicado en el Bosque de Chapultepec. ",Vinculan a proceso a presunto violador,https://www.jornada.com.mx/ultimas/capital/2020/09/06/vinculan-a-proceso-a-presunto-violador-3649.html,lajornada,www.jornada.com.mx,4,82
c882a9b9bb16a4686609fbc8896e0e51,"Ciudad de México. A través de su cuenta de Twitter, el diputado Porfirio Muñoz Ledo confirmó que buscará la dirigencia nacional de Morena, junto con la senadora Citlalli Hernández como secretaria general.“En reunión con la dirigencia de Morena agradecí la propuesta de presidir el partido junto con @CitlaHM como Secretaría General. Ofrecí trabajar por una candidatura de unidad, honestidad y lealtad a la 4T. ¡Gracias por su confianza!”, escribió en la red social.",Muñoz Ledo y Citlalli Hernández van juntos por dirigencia de Morena,https://www.jornada.com.mx/ultimas/politica/2020/09/06/munoz-ledo-y-citlalli-hernandez-van-juntos-por-dirigencia-de-morena-3730.html,lajornada,www.jornada.com.mx,8,40
5508fdc991684e6792ddcb205ee74931," El artista de Juchitán nos dejó inesperadamente, como todas las muertes lo hacen. El fallecimiento no pregunta si es buen tiempo para llegar: diré que siempre es inoportuno y que determina su conducta por las reglas de un extrañísimo azar. Así le llegó “la Pelona” a Toledo, sin avisar y sin pronunciar sermones, dejando estupefactos a sus admiradores y a la mayoría de los oficiales de la cultura que, a veces, no tuvieron mas remedio que ajustar sus tiempos a los necesarios homenajes, que a veces apenas duraron cinco minutos, como se quejan amigos y artistas oaxaqueños como ocurrió en el teatro Macedonio Alcalá, con la presencia del gobernador del Estado. Si alguien ha tenido un exacerbado sentido del tiempo fue el propio Francisco Toledo, y en ello residió uno de los signos más acabados de su genio: porque supo unir estéticamente el pasado de la especie y de muchas especies más dejando en trazos inolvidables por ejemplo la prehistoria de las iguanas que, en un arco mágico, viendo y adivinando sus semejanzas con las iguanas del porvenir, dando continuidad de permanencia a esa especie y, como derivado, a muchas otras que incluyó en su tremendo repertorio de animales y su evolución. Incluyendo la vida y la muerte de la especie humana, de la que Toledo rescata sus pulsaciones más profundas. Seguimos siendo una especie animal que se comporta según esas pulsaciones, propias de nuestra especie que en ocasiones florecen para gloria de nosotros y en otras para nuestra desgracia, según las circunstancias. No sé si Darwin estaría de acuerdo con esta mirada a su evolución de las especies, y mucho menos con la versión estética de la misma que nos ofrece la obra de Francisco Toledo. He aquí que la intuición del artista puede igualar, y a veces superar, las deducciones más elaboradas de la ciencia.Hace unos años, conversando con Julio Cortázar, y diciéndole yo que probablemente no había en el mundo una ciudad más fascinante que París, el gran cronopio que había cambiado su Buenos Aires del origen por la ciudad Lux me respondió que tal vez tenía la razón pero que nosotros teníamos a Oaxaca como una ciudad equivalente, sin desventaja con otras grandes ciudades del mundo. Que además era la tierra de Francisco Toledo, del que había visitado buena parte de su obra en varios museos de Oaxaca: ”Toledo es un gran artista, fascinante por muchos aspectos, uno de los cuales es la continuidad que encuentra en el pasado y en la actual historia de México, lo que le otorga una profundidad y una fuerza que sólo tienen los grandes poetas”. Debo decir (VFO) que seguramente aquellas palabras tuvieron el efecto de inspirarme en la comprensión de algunos aspectos de la obra artística de Toledo.Hablamos de la continuidad de las especies en la obra de Francisco Toledo. Deberían incluirse en este repertorio, verdaderamente darwiniano, además de las iguanas, monos, murciélagos, sapos e insectos de la más variada especie, que utilizó Francisco como bestiarios que vinculan al hombre con el mundo natural, sugiriendo que esa relación del hombre y de sus bestiarios con la naturaleza realmente se efectúa por el apareamiento, explicito o simbólico. La visión moral de Toledo afirma que el mundo de los humanos y el de los animales son uno por naturaleza. De ahí la pertinencia de mencionar a Darwin desde una estética particular, en este caso la de Francisco Toledo que lo ha llevado a recibir justificadamente, por notables del mundo científico y del mundo del arte, el adjetivo de genial. Toledo usó la modernidad y la vanguardia de otras civilizaciones, especialmente la europea, para sus obras y mostró un sentido de lo fantástico extraordinariamente desarrollado al crear criaturas antropomórficas que son a la vez monstruosas y juguetonas, personajes que incluye en sus papalotes, libros de artista, máscaras, piezas de joyería y complejos grabados. En varias notas para presentar la obra de Francisco Toledo se dice que, además de ser un prestigiado artista multifacético, fue un activista y mecenas que patrocinó infinidad de proyectos y organizaciones artísticas. Uno de las más notables es, sin duda, el Centro de las Artes de San Agustín, en Etla, al lado de Oaxaca.Sin duda Toledo fue un hombre de izquierda que siempre reaccionó vivamente en contra de los privilegios y riquezas que servían para mantener doblegados a los carentes de recursos. Su papel de activista se desempeñó sobre todo por sus innumerables reclamos a los burócratas y oficiales que aprovechaban sus nombramientos para imponer decisiones arbitrarias. Pero los reclamos y criticas de Toledo no se detenían en razón de las jerarquías de sus contrincantes sino que sus dardos alcanzaban también a los encumbrados en el poder circunstancial.Este complejo de facetas integran la personalidad de Francisco Toledo, uno de los grandes artistas y espíritus rebeldes en México de la ultima mitad del siglo XX y principios del XXI, que ahora nos ha abandonado. ¡Hasta siempre!  ",Francisco Toledo: un guiño a donde quiera que esté / Víctor Flores Olea,https://www.jornada.com.mx/ultimas/politica/2019/09/09/francisco-toledo-un-guino-a-donde-quiera-que-este-victor-flores-olea-7849.html,lajornada,www.jornada.com.mx,7,392
