uid,body,title,url,newspaper_uid,host,n_tokens_title,n_tokens_body
9235c4b18d0618b339f677fd685546bf,"Nueva York. Novak Djokovic fue expulsado el domingo del Abierto de Estados Unidos cuando accidentalmente le propinó una pelotazo a una jueza de silla en el cuello durante el partido por los octavos de final.Fue un fulminante final para la racha de 29 victorias de Djokovic, así como su empeño por conquistar un 18vo título de Grand Slam.El número uno del mundo acababa de perder un juego ante su rival, el español Pablo Carreño Busta, para quedar abajo 6-5 en el primer set.Cuando se encaminaba para el cambio de lado en el estadio Arthur Ashe, el astro serbio — que era el amplio favorito para llevarse el título — azotó la pelota detrás suyo. La pelota impactó a la jueza, que se desplomó de rodillas en el fondo de la pista y se llevó la mano al cuello.Durante una discusión de unos 10 minutos en la red que involucró a la jueza de silla Aurélie Tourte, el director de árbitros Soeren Friemel y al supervisor de Grand Slam Andreas Egli, Djokovic procuró defenderse. Pero acabó estrechándole la mano a Carreño Busta.Tourte procedió a anunciar que Djokovic fue descalificado, el equivalente en el tenis de una expulsión.“Estaba un poco en estado de shock”, dijo Carreño Busta, quien en una rueda de prensa virtual contó que no vio el momento en el que Djokovic lanzó la pelota a la jueza de línea. “Nunca esperé un momento así jugando contra Novak. Así que también fue un momento difícil para mí”.Djokovic se fue de inmediato del complejo sin dar declaraciones a la prensa y más tarde difundió una disculpa en sus redes sociales.“Todo esta situación me ha dejado muy triste y desolado. Fui a ver a la jueza de línea y el torneo me ha dicho que gracias a Dios se siente bien. Lamento mucho haberle causado semejante estrés. Sin ninguna intención. Muy mal”, escribió Djokovic.“En cuanto a la descalificación, necesito que mi decepción me sirva de lección para mi crecimiento y evolución como jugador y ser humano"", escribió. “Pido disculpas al torneo @usopen y a todos los tuvieron que han tenido que ver con mi conducta”.Cuando se le preguntó si se debió permitir a Djokovic que siguiera jugando, Carreño Busta respondió que “las reglas son las reglas”.“El árbitro y el supervisor hicieron lo correcto, pero no es fácil hacerlo”, añadió el español.Ciertamente. La Federación Estadounidense de tenis emitió un comunicado en el que explicó que Friemel descalificó Djokovic “cumpliendo el reglamento de Grand Slam, luego de sus acciones de golpear intencionalmente una pelota de manera peligrosa o imprudente dentro de la cancha o golpear una pelota sin medir las consecuencias"".La USTA añadió que Djokovic perdió los puntos de ránking en juego y los 250.000 dólares en premios que había embolsado en el torneo, “además de las multas que se le apliquen por el incidente”.Y es así cómo Djokovic quedó en el foco de la atención del mundo del tenis, más allá de su habilidad para devolver todo, punzantes disparos y estirar su cuerpo al máximo en su despliegue defensivo.Djokovic, de 33 años, dio positivo por el coronavirus — al igual que su esposa, uno de sus entrenadores y otros jugadores — tras participar en una serie de exhibiciones en las que no se siguió el distanciamiento social en Serbia y Croacia durante el mes de junio.En la víspera del US Open, emergió como uno de los líderes de una nueva asociación que pretende representar a los tenistas del circuito masculino.Y, desde luego, su hegemonía reciente en las canchas. Djokovic empezó el día con una marca de 26-0 esta temporada, y una racha de victorias que empezó en sus últimos tres partidos de 2019. Ganó cinco de los últimos siete grandes, para elevar su total a 17, poniéndose a tiro de sus rivales Roger Federer, dueño del récord de todos los tiempos con 20, y Rafael Nadal, quien atesora 19.Con las ausencias de Nadal, el reinante campeón del US Open que no quiso cruzar el Atlántico en medio de la pandemia, y Federer, baja tras dos cirugías en la rodilla derecha, todo apuntaba a que Djokovic se coronaría por cuarta vez en Nueva York y quedar más cerca de ellos.Todo se esfumó en instantes el domingo, pese a que evidente que Djokovic no tuvo la intención de golpear a la jueza de línea, alarmándose de inmediato tras percatarse de lo ocurrido.Pero jugadores que han descargado su enojo con un pelotazo que golpea a uno de los jueces han sido descalificados en otras ocasiones.En 2017, por ejemplo, Denis Shapovalov — el canadiense de 21 años que jugaba por la noche — fue descalificado en un partido de la Copa Davis ante Gran Bretaña cuando accidentalmente alcanzó en la cara al juez de silla con una pelota que lanzó.En el Wimbledon de 1995, Tim Henman impactó en la cabeza a una niña recogepelotas y fue descalificado en un partido de dobles.Entre los aspectos extraños de este US Open, el primer torneo de Grand Slam que se juega tras el comienzo de la pandemia, es que no hay espectadores.Lo otro es que en sólo los únicos dos grandes estadios — el Ashe y el Louis Armstrong — tienen dotación completa de jueces de línea. En las otras pistas, los jueces de sillas dependen de dispositivos electrónicos.Djokovic se había irritado minutos antes. En el juego anterior, malogró tres bolas de quiebre seguidas y, tras la última, que Carreño Busta ganó con un pelota dejada en corto, Djokovic mandó una bola contra un afiche de publicidad al costado.Casi de inmediato, en el que acabó siendo en su último juego de este US Open, Djokovic sufrió una caída al intentar una devolución, acusando dolor en el hombro izquierdo.El partido se interrumpió un breve rato para que Djokovic fuera examinado.En el segundo punto tras reanudar, Carreño Busta se apuntó un punto con un tiro ganador para romperle el saque a Djokovic. Fue cuando el serbio se metió en problemas.Su adiós a Nueva York deja al torneo huérfano de campeones de Grand Slam en el cuadro masculino. El que se proclame campeón será el primero que estrene su palmarés con el trofeo de un grande del tenis masculino desde 2014, cuando Marin Cilic ganó el US Open.Además, cada uno de los últimos 13 títulos de Grand Slam habían sido ganado por uno de los integrantes de los Tres Grandes, a sea Federer, Nadal y Djokovic.“Tendremos un nuevo campeón de Grand Slam. Es todo lo que sé. No quedan más campeones en el cuadro. Ahora es que se pone interesante la cosa"", dijo el alemán Alexander Zverev, uno de los pretendientes. El quinto preclasificado dio cuenta del español Alejandro Davidovich Fokina por 6-2, 6-2, 6-1 para acceder a cuartos.En el cuadro femenino, las estadounidenses Shelby Rogers y Jennifer Brady avanzaron a cuartos.Rogers, 93 del ránking, dio la sorpresa al eliminar a Petra Kvitova (6ta preclasificada) para figurar por segunda vez en la ronda de las ocho mejores de un grande y la primera en Flushing Meadows.Al abrir la jornada, Brady doblegó a 6-1, 6-4 y estará en cuartos por primera vez en un grande, tocándole enfrentar a Yulia Putintseva.",Descalifican a Djokovic del Abierto de EU por pelotazo a jueza,https://www.jornada.com.mx/ultimas/deportes/2020/09/06/descalifican-a-djokovic-del-abierto-de-eu-por-golpe-accidental-a-jueza-6699.html,lajornada,www.jornada.com.mx,6,566
2a07dc0363798f41a9757651fff21617,"Ciudad de México. La jefa de Gobierno de la Ciudad de México, Claudia Sheinbaum Pardo, entregó un el edificio de Canal de Miramontes 3020, colonia Girasoles, en Coyoacán, el cual fue rehabilitado tras las afectaciones que sufrió por el sismo del 19 de septiembre de 2017, con el suman 90 Multifamiliares entregados a los damnificados.Durante el acto, el comisionado para la Reconstrucion de la Ciudad de México, César Cravioto, señaló que en total son 370 edificios los que resultaron dañados por el temblor, de los cuales 75 por ciento estarán en proceso de  obra.En el caso de las viviendas unifamiliares, dijo que un se han concluido dos mil 263 unidades, tres mil 168 están en proceso y faltan mil 462 por iniciar su intervención.Durante el acto, se presentó la nueva página de Internet de transparencia de la reconstrucción, en el que se se especifica que en dicho proceso el gobierno capitalino tiene comprometidos más de 3 mil millones de pesos, de los cuales se han ejercido mil 800 millones y queda un saldo dos mil millones en el fideicomiso creado para tal fin.Cravioto señaló que el portal electrónico será actualizado cada mes y destacó que la nueva versión incluye toda la información sobre el proceso de intervención de cada uno de los inmuebles censados, como la empresa encargada de la rehabilitación o reedificación, director de responsable de obra y presupuesto destinado. ",Entrega Sheinbaum edificio rehabilitado en Canal de Miramontes,https://www.jornada.com.mx/ultimas/capital/2020/09/06/entrega-sheinbaum-edificio-rehabilitado-en-canal-de-miramontes-5208.html,lajornada,www.jornada.com.mx,6,109
f5d362c95d3c5edb3898184b0a5282e5,"Ciudad de México. Es de esperar que en los meses siguientes el ahorro de empresas y personas en instrumentos bancarios comenzará a desacelerar como consecuencia de la pandemia de Covid-19, pues se tendrán más claros los impactos de la crisis actual dentro del sector financiero, adelantó BBVA Research.En un análisis, el área de investigación de BBVA México indicó que el saldo de la captación tradicional del sistema bancario se mantiene elevado tras la depreciación cambiaria y el impulso al ahorro precautorio propiciados por la epidemia, pero los efectos de la recesión económica poco a poco comienzan a reflejarse en la disposición de esos recursos, particularmente en lo que toca a los depósitos a plazo tanto de empresas como de personas físicas.Los datos disponibles más recientes del Banco de México (BdeM) indican que la captación tradicional subió 0.4 por ciento en términos nominales (contracción de 0.1 en términos reales) de mayo a junio, apoyada en un crecimiento de 0.6 nominal mensual del segmento de vista y de un alza de 0.1 también nominal de la captación a plazo.En comparación con el mismo mes del año anterior, precisó el banco, la tasa nominal de crecimiento de la captación tradicional en junio fue de 12.4 por ciento (8.8 por ciento real), lo cual refleja el efecto base positivo en las cifras del ya mencionado impulso a la captación como consecuencia de la pandemia.Es de esperarse que en la comparación anual se mantengan tasas elevadas, aunque éstas tenderán a desacelerarse durante la segunda parte del año.BBVA precisó que si bien el continuo crecimiento del ahorro de las personas ha sido inesperado, luce difícil que pueda mantener su tendencia al alza en los meses próximos ante la menor demanda laboral.En consecuencia, mantenemos la expectativa de que el saldo de la captación aumentará su desaceleración en los meses próximos, en la medida en que se dejen sentir con más fuerza los efectos de la recesión económica, detalló la institución.Según BBVA, uno de los segmentos que ya han comenzado a ver los efectos de la actual coyuntura es la captación a plazos, que representa 39 por ciento de la tradicional, pues desde agosto de 2019 había mantenido un ritmo de crecimiento y de mayo a junio cayó 0.4 por ciento en términos reales.Expuso que esa baja mensual fue resultado de una reducción del saldo de ese tipo de depósitos por personas físicas, que se redujo 0.8 por ciento en términos reales y 0.3 en las empresas.De acuerdo con información de la Asociación de Bancos de México, en el primer semestre del año el saldo de la captación bancaria ha tenido un incremento de 750 mil millones de pesos para llegar a poco más de 6 billones 800 mil millones. ",Se avecina una desaceleración del ahorro en bancos: BBVA,https://www.jornada.com.mx/ultimas/economia/2020/09/06/se-avecina-una-desaceleracion-del-ahorro-en-bancos-bbva-9932.html,lajornada,www.jornada.com.mx,5,212
b718d89998bea651c1fe3f18d6feaf8c,"Ciudad de México. Con la finalidad de evitar el cierre del Salón Los Ángeles, el cual ha sido afectado por la crisis económica derivada de la pandemia por SARS-CoV-2 y las medidas de distanciamiento social establecidas, entre ayer y hoy se realiza un bazar.Allí en el salón, lugar emblemático del danzón, 60 expositores ofertan diversos artículos, entre ellos alimentos típicos, plantas, fotografías, artesanías, artículos para el hogar, cuadros y ropa típica, entre otros.Desde las 11 de la mañana y hasta las 17:30 horas las puertas del salón, ubicado en la calle Lerdo, en la alcaldía Cuauhtémoc, estarán abiertas para quien desee visitar el lugar y adquirir algunos productos, con lo cual se colabora tanto a la permanencia del recinto como a trabajadores de medios de comunicación que quedaron desempleados o les fue reducido su salario.En el lugar se siguen las medidas sanitarias para disminuir la posibilidad de contagio del Covid-19, ente ellas uso de cubrebocas, alcohol gel y caretas en algunos casos.El salón cerró sus puertas el 22 de marzo pasado, para disminuir las posibilidades de contagio, los establecimientos no esenciales dejaron de funcionar. Tiene poco más de ocho décadas de historia, y los poco más de cinco meses sin actividades lo tienen al borde del cierre definitivo.Nunca antes habían experimentado un cese de actividades tan largo, ni siquiera durante la pandemia de influenza H1N1, ocasión en que permaneció cerrado unas dos semanas.  ",Bazar para mantener vivo al Salón Los Ángeles,https://www.jornada.com.mx/ultimas/espectaculos/2020/09/06/bazar-para-mantener-vivo-al-salon-los-angeles-777.html,lajornada,www.jornada.com.mx,5,109
93cabfcf8437ba8d0f5ea352951a3754,"Ciudad de México. Tres meses después de haber comenzado la reactivación en el sector turismo, destinos como Puerto Vallarta, Jalisco; Cancún, Quintana Roo, y Acapulco, Guerrero, muestran signos de recuperación y se prevé mejoría en la principal actividad económica de esos estados.Luis Villaseñor, director interino del Fideicomiso de Promoción y Publicidad Turística de Puerto Vallarta, comentó a La Jornada que han tenido resultados muy positivos, pues en junio la capacidad máxima para hoteles era de 25 por ciento y se terminó ese mes en 12.5, cifra que se ha modificado con el mismo aforo. Se calcula, dijo, que el promedio alcanzó 18 por ciento en agosto.Los fines de semana el destino ha reportado una ocupación casi total, pues oscila entre 23 y 25 por ciento, principalmente por la visita de paseantes que van de El Bajío y Guadalajara.Este mes, comentó, los hoteles podrán operar a 50 por ciento de su capacidad, mientras otros establecimientos, por ejemplo bares y centros nocturnos, también abrirán con ese límite y se unirán espacios como teatros, galerías y unidades deportivas.Sobre la conectividad, comentó que la afluencia de visitantes por vías aérea y terrestre ha sido equilibrada. Por cuestiones económicas o de seguridad, los turistas han optado por la segunda opción. En el caso de los viajes por autobús, éstos limitan su capacidad total.Añadió que líneas aéreas, como Volaris, Viva Aerobus, Aeroméxico, Aeromar, Magnicharters, Delta y American Airlines, tienen ocupaciones superiores a 80 por ciento, por lo que ha habido una buena respuesta de los viajeros de urbes mexicanas, como Monterrey, Chihuahua y Ciudad de México. Destacó que no han perdido conectividad con Estados Unidos y existen vuelos a Los Ángeles, Houston y próximamente Charlotte, ruta que será estrenada por American Airlines en diciembre.El flujo de pasajeros internacionales en el aeropuerto de Puerto Vallarta fue de 37 mil 900 al cierre de agosto, mientras de nacionales sumó 81 mil 800, de acuerdo con el Grupo Aeroportuario del Pacífico.Aseguró que pocos hoteles no han reabierto, pero han aprovechado para efectuar remodelaciones y en octubre se encontrarán de regreso, pues planean estar a tiempo para el invierno.Cambió el semáforo epidemiológicoFrank López Reyes, director general de Turismo en Cancún, comentó que el gobierno de Quintana Roo ya anunció el cambio del semáforo epidemiológico, el cual es diferente al federal. Detalló que en el color amarillo abrirán playas, sitios arqueológicos, teatros y gimnasios, mientras los hoteles tendrán un aforo de 60 por ciento, lo cual es buena noticia.Señaló que el Aeropuerto Internacional de Cancún ya presenta una recuperación de cerca de 40 por ciento del volumen de operaciones y, en promedio, tiene 200 vuelos, entre llegadas y salidas. La conectividad con el extranjero ha comenzado a ampliarse, pues Copa Airlines tendrá una ruta desde Panamá, por lo que ya no sólo habrá traslados desde Canadá y Estados Unidos.En octubre próximo, puntualizó, Air France restablecerá los vuelos París-Cancún y en noviembre American Airlines prevé reanudar todas sus rutas hacia este destino.López Reyes aseguró que la demanda de hoteles ha sido de 30 por ciento, que era el límite máximo. Ahora se verán beneficiados al tener permiso para usar 60 por ciento de su capacidad.Al cierre del año, confió, la recuperación será de 60 por ciento, cifra que si bien no es la mejor, comparada con la de otros años, es la más destacada tras la suspensión de actividades.José Luis Smithers, presidente de la Asociación de Hoteles y Empresas Turísticas en Acapulco, expresó que están contentos por estar en semáforo amarillo, pues ello es resultado de los esfuerzos de sociedad y hoteleros, que cumplen con los lineamientos de higiene y seguridad.Comentó que ya están a 45 por ciento de la capacidad de hoteles, aunque el tope sigue siendo limitado, mientras restaurantes y clubes nocturnos ya han abierto. Añadió que Aeromar continúa haciendo vuelos hacia Acapulco y hoy Aeroméxico reiniciará operaciones, aunque 90 por ciento de la conectividad es terrestre.  ",Indicios de recuperación en sector turismo de 3 estados,https://www.jornada.com.mx/ultimas/economia/2020/09/06/indicios-de-recuperacion-en-sector-turismo-de-3-estados-3125.html,lajornada,www.jornada.com.mx,4,329
d3e8929ac70e0d700d82414bf74b6b44,"Londres. Veintiséis personas fueron inculpadas en el reino Unido tras el bloqueo de imprentas por militantes del grupo ecologista Extinction Rebellion, que perturbaron el sábado pasado la distribución de diarios, anunció el domingo la policía.Varias decenas de militantes bloquearon en la noche de viernes a sábado los accesos a dos imprentas del grupo Newsprint y acusaron a varios diarios, especialmente del grupo News Corp del magnate Rupert Murdoch, de no abordar correctamente ""la urgencia climática y ecológica"".Según un comunicado de la policía local, 26 personas fueron inculpadas por ""intrusión agravada"" y liberados bajo condiciones después del bloqueo de la imprenta de Knowsley, cerca de Liverpool.Cincuenta personas fueron puestas en detención provisional tras el bloqueo de otra imprenta, en Broxbourne, en el norte de Londres.Esta acción, ampliamente denunciada como un ataque contra la libertad de prensa, causó una ola de condenas en el país, desde el primer ministro conservador Boris Johnson hasta la oposición laborista.",Inculpan a militantes de Extinction Rebellion por bloqueo de imprentas,https://www.jornada.com.mx/ultimas/mundo/2020/09/06/inculpan-a-militantes-de-extinction-rebellion-por-bloqueo-de-imprentas-7929.html,lajornada,www.jornada.com.mx,6,88
